10:13:19.987226 IP GRAF2.1374 > student.uci.agh.edu.pl.22: S 889246656:889246656(0) win 65535 <mss 1460,nop,nop,sackOK>
10:13:19.987974 IP student.uci.agh.edu.pl.22 > GRAF2.1374: S 349401649:349401649(0) ack 889246657 win 24820 <nop,nop,sackOK,mss 1460>
10:13:19.988317 IP GRAF2.1374 > student.uci.agh.edu.pl.22: . ack 1 win 65535
10:13:20.006832 IP GRAF2.1043 > luke.icsr.agh.edu.pl.53:  11356+ PTR? 127.99.156.149.in-addr.arpa. (45)
10:13:20.006873 IP student.uci.agh.edu.pl.54836 > GRAF2.113: S 349566443:349566443(0) win 24820 <nop,nop,sackOK,mss 1460>
10:13:20.007362 IP luke.icsr.agh.edu.pl.53 > GRAF2.1043:  11356 NXDomain* 0/1/0 (135)
10:13:20.019321 IP GRAF2.1043 > luke.icsr.agh.edu.pl.53:  17758+ PTR? 53.99.156.149.in-addr.arpa. (44)
10:13:20.019981 IP luke.icsr.agh.edu.pl.53 > GRAF2.1043:  17758* 1/2/3 (197)
10:13:20.088749 IP wind.icsr.agh.edu.pl.137 > 149.156.99.185.137: UDP, length: 50
10:13:20.838727 IP wind.icsr.agh.edu.pl.137 > 149.156.99.185.137: UDP, length: 50
10:13:21.004995 IP student.uci.agh.edu.pl.54836 > GRAF2.113: R 349566444:349566444(0) win 24820
10:13:21.005533 IP student.uci.agh.edu.pl.22 > GRAF2.1374: P 1:26(25) ack 1 win 24820
10:13:21.006525 IP GRAF2.1374 > student.uci.agh.edu.pl.22: P 1:28(27) ack 26 win 65510
10:13:21.006993 IP student.uci.agh.edu.pl.22 > GRAF2.1374: . ack 28 win 24820
10:13:21.011649 IP GRAF2.1043 > luke.icsr.agh.edu.pl.53:  12894+ PTR? 124.99.156.149.in-addr.arpa. (45)
10:13:21.012350 IP luke.icsr.agh.edu.pl.53 > GRAF2.1043:  12894* 1/2/3 (198)
10:13:21.014378 IP student.uci.agh.edu.pl.22 > GRAF2.1374: P 26:634(608) ack 28 win 24820
10:13:21.028889 IP GRAF2.1374 > student.uci.agh.edu.pl.22: P 28:500(472) ack 634 win 64902
10:13:21.029351 IP GRAF2.1374 > student.uci.agh.edu.pl.22: P 500:516(16) ack 634 win 64902
10:13:21.029717 IP student.uci.agh.edu.pl.22 > GRAF2.1374: . ack 516 win 24820
10:13:21.055076 IP student.uci.agh.edu.pl.22 > GRAF2.1374: P 634:1058(424) ack 516 win 24820
10:13:21.242532 IP GRAF2.1374 > student.uci.agh.edu.pl.22: . ack 1058 win 64478
10:13:21.811626 IP GRAF2.1374 > student.uci.agh.edu.pl.22: P 516:932(416) ack 1058 win 64478
10:13:21.904827 IP student.uci.agh.edu.pl.22 > GRAF2.1374: . ack 932 win 24820
10:13:22.342262 IP comma.icsr.agh.edu.pl.137 > 149.156.99.185.137: UDP, length: 50
10:13:22.370459 IP student.uci.agh.edu.pl.22 > GRAF2.1374: P 1058:1794(736) ack 932 win 24820
10:13:22.554995 IP GRAF2.1374 > student.uci.agh.edu.pl.22: . ack 1794 win 65535
10:13:23.091988 IP comma.icsr.agh.edu.pl.137 > 149.156.99.185.137: UDP, length: 50
10:13:23.487659 IP GRAF2.1374 > student.uci.agh.edu.pl.22: P 932:948(16) ack 1794 win 65535
10:13:23.488538 IP GRAF2.1374 > student.uci.agh.edu.pl.22: P 948:1000(52) ack 1794 win 65535
10:13:23.489100 IP student.uci.agh.edu.pl.22 > GRAF2.1374: . ack 1000 win 24820
10:13:23.489416 IP student.uci.agh.edu.pl.22 > GRAF2.1374: P 1794:1846(52) ack 1000 win 24820
10:13:23.646852 IP GRAF2.1043 > luke.icsr.agh.edu.pl.53:  30801+ A? www.google.pl. (31)
10:13:23.648700 IP GRAF2.1374 > student.uci.agh.edu.pl.22: . ack 1846 win 65483
10:13:23.707102 IP luke.icsr.agh.edu.pl.53 > GRAF2.1043:  30801 3/10/10[|domain]
10:13:23.758565 IP GRAF2.1376 > 66.102.9.99.80: S 2431371921:2431371921(0) win 65535 <mss 1460,nop,nop,sackOK>
10:13:23.820238 IP 66.102.9.99.80 > GRAF2.1376: S 3485505456:3485505456(0) ack 2431371922 win 8190 <mss 1460>
10:13:23.820599 IP GRAF2.1376 > 66.102.9.99.80: . ack 1 win 65535
10:13:23.821470 IP GRAF2.1376 > 66.102.9.99.80: P 1:466(465) ack 1 win 65535
10:13:23.841996 IP comma.icsr.agh.edu.pl.137 > 149.156.99.185.137: UDP, length: 50
10:13:23.878924 IP 66.102.9.99.80 > GRAF2.1376: . ack 466 win 7725
10:13:23.880371 IP 66.102.9.99.80 > GRAF2.1376: . ack 466 win 6432
10:13:23.891497 IP 66.102.9.99.80 > GRAF2.1376: P 1431:1636(205) ack 466 win 6432
10:13:23.891767 IP GRAF2.1376 > 66.102.9.99.80: . ack 1 win 65535
10:13:23.892105 IP 66.102.9.99.80 > GRAF2.1376: . 1:1431(1430) ack 466 win 6432
10:13:23.892463 IP GRAF2.1376 > 66.102.9.99.80: . ack 1636 win 65535
10:13:24.091060 IP GRAF2.1043 > luke.icsr.agh.edu.pl.53:  51025+ PTR? 99.9.102.66.in-addr.arpa. (42)
10:13:24.186635 IP GRAF2.1063 > luke.icsr.agh.edu.pl.53:  34129+ A? toolbarqueries.google.com. (43)
10:13:24.297127 IP luke.icsr.agh.edu.pl.53 > GRAF2.1043:  51025 NXDomain* 0/1/0 (102)
10:13:24.297762 IP GRAF2.137 > 66.102.9.99.137: UDP, length: 50
10:13:24.338636 IP wind.icsr.agh.edu.pl.137 > 149.156.99.185.137: UDP, length: 50
10:13:24.364343 IP luke.icsr.agh.edu.pl.53 > GRAF2.1063:  34129 2/4/4[|domain]
10:13:24.400314 IP GRAF2.1377 > 216.239.59.104.80: S 1048304281:1048304281(0) win 65535 <mss 1460,nop,nop,sackOK>
10:13:24.456464 IP 216.239.59.104.80 > GRAF2.1377: S 1981174880:1981174880(0) ack 1048304282 win 8190 <mss 1460>
10:13:24.456835 IP GRAF2.1377 > 216.239.59.104.80: . ack 1 win 65535
10:13:24.457454 IP GRAF2.1377 > 216.239.59.104.80: P 1:410(409) ack 1 win 65535
10:13:24.514188 IP 216.239.59.104.80 > GRAF2.1377: . ack 410 win 7781
10:13:24.514834 IP 216.239.59.104.80 > GRAF2.1377: . ack 410 win 6432
10:13:24.528973 IP 216.239.59.104.80 > GRAF2.1377: P 1:175(174) ack 410 win 6432
10:13:24.742439 IP GRAF2.1377 > 216.239.59.104.80: . ack 175 win 65361
10:13:25.088632 IP wind.icsr.agh.edu.pl.137 > 149.156.99.185.137: UDP, length: 50
10:13:25.789244 IP GRAF2.137 > 66.102.9.99.137: UDP, length: 50
10:13:26.596436 IP GRAF2.1378 > arax.uci.agh.edu.pl.80: S 3076937488:3076937488(0) win 65535 <mss 1460,nop,nop,sackOK>
10:13:26.597366 IP arax.uci.agh.edu.pl.80 > GRAF2.1378: S 1164017957:1164017957(0) ack 3076937489 win 24820 <nop,nop,sackOK,mss 1460>
10:13:26.597706 IP GRAF2.1378 > arax.uci.agh.edu.pl.80: . ack 1 win 65535
10:13:26.598407 IP GRAF2.1378 > arax.uci.agh.edu.pl.80: P 1:380(379) ack 1 win 65535
10:13:26.599104 IP arax.uci.agh.edu.pl.80 > GRAF2.1378: . ack 380 win 24820
10:13:26.603146 IP arax.uci.agh.edu.pl.80 > GRAF2.1378: . 1:1461(1460) ack 380 win 24820
10:13:26.603459 IP arax.uci.agh.edu.pl.80 > GRAF2.1378: P 1461:2921(1460) ack 380 win 24820
10:13:26.603680 IP GRAF2.1378 > arax.uci.agh.edu.pl.80: . ack 2921 win 65535
10:13:26.603705 IP arax.uci.agh.edu.pl.80 > GRAF2.1378: P 2921:4381(1460) ack 380 win 24820
10:13:26.604511 IP arax.uci.agh.edu.pl.80 > GRAF2.1378: P 4381:5423(1042) ack 380 win 24820
10:13:26.604852 IP GRAF2.1378 > arax.uci.agh.edu.pl.80: . ack 5423 win 65535
10:13:26.701538 IP GRAF2.1378 > arax.uci.agh.edu.pl.80: P 380:645(265) ack 5423 win 65535
10:13:26.703687 IP arax.uci.agh.edu.pl.80 > GRAF2.1378: . 5423:6883(1460) ack 645 win 24820
10:13:26.703996 IP arax.uci.agh.edu.pl.80 > GRAF2.1378: P 6883:8343(1460) ack 645 win 24820
10:13:26.704217 IP GRAF2.1378 > arax.uci.agh.edu.pl.80: . ack 8343 win 65535
10:13:26.704242 IP arax.uci.agh.edu.pl.80 > GRAF2.1378: . 8343:9803(1460) ack 645 win 24820
10:13:26.704427 IP arax.uci.agh.edu.pl.80 > GRAF2.1378: P 9803:11263(1460) ack 645 win 24820
10:13:26.704629 IP GRAF2.1378 > arax.uci.agh.edu.pl.80: . ack 11263 win 65535
10:13:26.704647 IP arax.uci.agh.edu.pl.80 > GRAF2.1378: P 11263:12723(1460) ack 645 win 24820
10:13:26.705253 IP arax.uci.agh.edu.pl.80 > GRAF2.1378: . 12723:14183(1460) ack 645 win 24820
10:13:26.705592 IP GRAF2.1378 > arax.uci.agh.edu.pl.80: . ack 14183 win 65535
10:13:26.705639 IP arax.uci.agh.edu.pl.80 > GRAF2.1378: . 14183:15643(1460) ack 645 win 24820
10:13:26.705776 IP arax.uci.agh.edu.pl.80 > GRAF2.1378: P 15643:17103(1460) ack 645 win 24820
10:13:26.705989 IP GRAF2.1378 > arax.uci.agh.edu.pl.80: . ack 17103 win 64915
10:13:26.706033 IP arax.uci.agh.edu.pl.80 > GRAF2.1378: . 17103:18563(1460) ack 645 win 24820
10:13:26.706169 IP arax.uci.agh.edu.pl.80 > GRAF2.1378: . 18563:20023(1460) ack 645 win 24820
10:13:26.706337 IP GRAF2.1378 > arax.uci.agh.edu.pl.80: . ack 20023 win 61995
10:13:26.706351 IP arax.uci.agh.edu.pl.80 > GRAF2.1378: P 20023:21483(1460) ack 645 win 24820
10:13:26.706606 IP arax.uci.agh.edu.pl.80 > GRAF2.1378: . 21483:22943(1460) ack 645 win 24820
10:13:26.706828 IP GRAF2.1378 > arax.uci.agh.edu.pl.80: . ack 22943 win 59075
10:13:26.706861 IP arax.uci.agh.edu.pl.80 > GRAF2.1378: . 22943:24403(1460) ack 645 win 24820
10:13:26.706997 IP arax.uci.agh.edu.pl.80 > GRAF2.1378: P 24403:25863(1460) ack 645 win 24820
10:13:26.707166 IP GRAF2.1378 > arax.uci.agh.edu.pl.80: . ack 25863 win 56155
10:13:26.707187 IP arax.uci.agh.edu.pl.80 > GRAF2.1378: . 25863:27323(1460) ack 645 win 24820
10:13:26.707306 IP arax.uci.agh.edu.pl.80 > GRAF2.1378: . 27323:28783(1460) ack 645 win 24820
10:13:26.707472 IP GRAF2.1378 > arax.uci.agh.edu.pl.80: . ack 28783 win 53235
10:13:26.707501 IP arax.uci.agh.edu.pl.80 > GRAF2.1378: P 28783:30243(1460) ack 645 win 24820
10:13:26.707625 IP arax.uci.agh.edu.pl.80 > GRAF2.1378: P 30243:30589(346) ack 645 win 24820
10:13:26.707793 IP GRAF2.1378 > arax.uci.agh.edu.pl.80: . ack 30589 win 51429
10:13:26.774467 IP GRAF2.1379 > arax.uci.agh.edu.pl.80: S 1116771056:1116771056(0) win 65535 <mss 1460,nop,nop,sackOK>
10:13:26.775176 IP arax.uci.agh.edu.pl.80 > GRAF2.1379: S 1164251707:1164251707(0) ack 1116771057 win 24820 <nop,nop,sackOK,mss 1460>
10:13:26.775499 IP GRAF2.1379 > arax.uci.agh.edu.pl.80: . ack 1 win 65535
10:13:26.776921 IP GRAF2.1379 > arax.uci.agh.edu.pl.80: P 1:266(265) ack 1 win 65535
10:13:26.777596 IP arax.uci.agh.edu.pl.80 > GRAF2.1379: . ack 266 win 24820
10:13:26.779209 IP arax.uci.agh.edu.pl.80 > GRAF2.1379: . 1:1461(1460) ack 266 win 24820
10:13:26.779511 IP arax.uci.agh.edu.pl.80 > GRAF2.1379: P 1461:2921(1460) ack 266 win 24820
10:13:26.779731 IP GRAF2.1379 > arax.uci.agh.edu.pl.80: . ack 2921 win 65535
10:13:26.779755 IP arax.uci.agh.edu.pl.80 > GRAF2.1379: P 2921:4381(1460) ack 266 win 24820
10:13:26.780797 IP GRAF2.1378 > arax.uci.agh.edu.pl.80: . ack 30589 win 65535
10:13:26.780858 IP arax.uci.agh.edu.pl.80 > GRAF2.1379: . 4381:5841(1460) ack 266 win 24820
10:13:26.781126 IP GRAF2.1379 > arax.uci.agh.edu.pl.80: . ack 5841 win 65535
10:13:26.781147 IP arax.uci.agh.edu.pl.80 > GRAF2.1379: . 5841:7301(1460) ack 266 win 24820
10:13:26.781293 IP arax.uci.agh.edu.pl.80 > GRAF2.1379: P 7301:8761(1460) ack 266 win 24820
10:13:26.781506 IP GRAF2.1379 > arax.uci.agh.edu.pl.80: . ack 8761 win 65535
10:13:26.782161 IP arax.uci.agh.edu.pl.80 > GRAF2.1379: . 8761:10221(1460) ack 266 win 24820
10:13:26.782457 IP arax.uci.agh.edu.pl.80 > GRAF2.1379: . 10221:11681(1460) ack 266 win 24820
10:13:26.782660 IP GRAF2.1379 > arax.uci.agh.edu.pl.80: . ack 11681 win 62615
10:13:26.782682 IP arax.uci.agh.edu.pl.80 > GRAF2.1379: P 11681:13141(1460) ack 266 win 24820
10:13:26.782827 IP arax.uci.agh.edu.pl.80 > GRAF2.1379: . 13141:14601(1460) ack 266 win 24820
10:13:26.783017 IP GRAF2.1379 > arax.uci.agh.edu.pl.80: . ack 14601 win 59695
10:13:26.783036 IP arax.uci.agh.edu.pl.80 > GRAF2.1379: . 14601:16061(1460) ack 266 win 24820
10:13:26.783209 IP arax.uci.agh.edu.pl.80 > GRAF2.1379: P 16061:17521(1460) ack 266 win 24820
10:13:26.783394 IP GRAF2.1379 > arax.uci.agh.edu.pl.80: . ack 17521 win 56775
10:13:26.783747 IP arax.uci.agh.edu.pl.80 > GRAF2.1379: . 17521:18981(1460) ack 266 win 24820
10:13:26.783965 IP arax.uci.agh.edu.pl.80 > GRAF2.1379: . 18981:20441(1460) ack 266 win 24820
10:13:26.784151 IP GRAF2.1379 > arax.uci.agh.edu.pl.80: . ack 20441 win 53855
10:13:26.784192 IP arax.uci.agh.edu.pl.80 > GRAF2.1379: P 20441:21901(1460) ack 266 win 24820
10:13:26.784323 IP arax.uci.agh.edu.pl.80 > GRAF2.1379: . 21901:23361(1460) ack 266 win 24820
10:13:26.784490 IP GRAF2.1379 > arax.uci.agh.edu.pl.80: . ack 23361 win 50935
10:13:26.784511 IP arax.uci.agh.edu.pl.80 > GRAF2.1379: . 23361:24821(1460) ack 266 win 24820
10:13:26.784634 IP arax.uci.agh.edu.pl.80 > GRAF2.1379: P 24821:26281(1460) ack 266 win 24820
10:13:26.784803 IP GRAF2.1379 > arax.uci.agh.edu.pl.80: . ack 26281 win 48015
10:13:26.784816 IP arax.uci.agh.edu.pl.80 > GRAF2.1379: . 26281:27741(1460) ack 266 win 24820
10:13:26.784967 IP arax.uci.agh.edu.pl.80 > GRAF2.1379: . 27741:29201(1460) ack 266 win 24820
10:13:26.785141 IP GRAF2.1379 > arax.uci.agh.edu.pl.80: . ack 29201 win 45095
10:13:26.785155 IP arax.uci.agh.edu.pl.80 > GRAF2.1379: P 29201:30661(1460) ack 266 win 24820
10:13:26.785282 IP arax.uci.agh.edu.pl.80 > GRAF2.1379: P 30661:31988(1327) ack 266 win 24820
10:13:26.785448 IP GRAF2.1379 > arax.uci.agh.edu.pl.80: . ack 31988 win 42308
10:13:26.800892 IP GRAF2.1379 > arax.uci.agh.edu.pl.80: . ack 31988 win 46068
10:13:26.811531 IP GRAF2.1379 > arax.uci.agh.edu.pl.80: . ack 31988 win 65535
10:13:26.823934 IP GRAF2.1378 > arax.uci.agh.edu.pl.80: P 645:910(265) ack 30589 win 65535
10:13:26.825769 IP arax.uci.agh.edu.pl.80 > GRAF2.1378: P 30589:31396(807) ack 910 win 24820
10:13:26.837774 IP GRAF2.1379 > arax.uci.agh.edu.pl.80: P 266:528(262) ack 31988 win 65535
10:13:26.839623 IP arax.uci.agh.edu.pl.80 > GRAF2.1379: P 31988:32904(916) ack 528 win 24820
10:13:26.861970 IP GRAF2.1378 > arax.uci.agh.edu.pl.80: P 910:1173(263) ack 31396 win 64728
10:13:26.864097 IP arax.uci.agh.edu.pl.80 > GRAF2.1378: . 31396:32856(1460) ack 1173 win 24820
10:13:26.864398 IP arax.uci.agh.edu.pl.80 > GRAF2.1378: P 32856:34316(1460) ack 1173 win 24820
10:13:26.864619 IP GRAF2.1378 > arax.uci.agh.edu.pl.80: . ack 34316 win 65535
10:13:26.864643 IP arax.uci.agh.edu.pl.80 > GRAF2.1378: P 34316:34914(598) ack 1173 win 24820
10:13:26.900938 IP GRAF2.1377 > 216.239.59.104.80: P 410:847(437) ack 175 win 65361
10:13:26.995634 IP 216.239.59.104.80 > GRAF2.1377: . ack 847 win 7504
10:13:27.002857 IP 216.239.59.104.80 > GRAF2.1377: P 175:349(174) ack 847 win 7504
10:13:27.039249 IP GRAF2.1379 > arax.uci.agh.edu.pl.80: . ack 32904 win 64619
10:13:27.039341 IP GRAF2.1378 > arax.uci.agh.edu.pl.80: . ack 34914 win 64937
10:13:27.148632 IP GRAF2.1377 > 216.239.59.104.80: . ack 349 win 65187
10:13:27.289206 IP GRAF2.137 > 66.102.9.99.137: UDP, length: 50
10:13:27.832164 IP GRAF2.1380 > gucio.eaie.agh.edu.pl.80: S 718262502:718262502(0) win 65535 <mss 1460,nop,nop,sackOK>
10:13:27.833043 IP gucio.eaie.agh.edu.pl.80 > GRAF2.1380: S 3974989823:3974989823(0) ack 718262503 win 5840 <mss 1460,nop,nop,sackOK>
10:13:27.833375 IP GRAF2.1380 > gucio.eaie.agh.edu.pl.80: . ack 1 win 65535
10:13:27.834076 IP GRAF2.1380 > gucio.eaie.agh.edu.pl.80: P 1:385(384) ack 1 win 65535
10:13:27.834953 IP gucio.eaie.agh.edu.pl.80 > GRAF2.1380: . ack 385 win 6432
10:13:27.838756 IP wind.icsr.agh.edu.pl.138 > 149.156.99.185.138: UDP, length: 174
10:13:27.839058 IP wind.icsr.agh.edu.pl.137 > 149.156.99.185.137: UDP, length: 50
10:13:27.868833 IP gucio.eaie.agh.edu.pl.80 > GRAF2.1380: . 1:1461(1460) ack 385 win 6432
10:13:27.869137 IP gucio.eaie.agh.edu.pl.80 > GRAF2.1380: . 1461:2921(1460) ack 385 win 6432
10:13:27.869345 IP GRAF2.1380 > gucio.eaie.agh.edu.pl.80: . ack 2921 win 65535
10:13:27.870745 IP gucio.eaie.agh.edu.pl.80 > GRAF2.1380: P 2921:4149(1228) ack 385 win 6432
10:13:27.871082 IP GRAF2.1380 > gucio.eaie.agh.edu.pl.80: . ack 4149 win 64307
10:13:27.889573 IP gucio.eaie.agh.edu.pl.80 > GRAF2.1380: . 4149:5609(1460) ack 385 win 6432
10:13:27.889863 IP gucio.eaie.agh.edu.pl.80 > GRAF2.1380: . 5609:7069(1460) ack 385 win 6432
10:13:27.890067 IP GRAF2.1380 > gucio.eaie.agh.edu.pl.80: . ack 7069 win 65535
10:13:27.890091 IP gucio.eaie.agh.edu.pl.80 > GRAF2.1380: P 7069:8372(1303) ack 385 win 6432
10:13:27.890328 IP GRAF2.1380 > gucio.eaie.agh.edu.pl.80: . ack 8372 win 64232
10:13:27.891739 IP gucio.eaie.agh.edu.pl.80 > GRAF2.1380: . 8372:9832(1460) ack 385 win 6432
10:13:27.892041 IP gucio.eaie.agh.edu.pl.80 > GRAF2.1380: . 9832:11292(1460) ack 385 win 6432
10:13:27.892245 IP GRAF2.1380 > gucio.eaie.agh.edu.pl.80: . ack 11292 win 65535
10:13:27.892270 IP gucio.eaie.agh.edu.pl.80 > GRAF2.1380: P 11292:12595(1303) ack 385 win 6432
10:13:27.892493 IP GRAF2.1380 > gucio.eaie.agh.edu.pl.80: . ack 12595 win 64232
10:13:27.901703 IP gucio.eaie.agh.edu.pl.80 > GRAF2.1380: . 12595:14055(1460) ack 385 win 6432
10:13:27.901999 IP gucio.eaie.agh.edu.pl.80 > GRAF2.1380: . 14055:15515(1460) ack 385 win 6432
10:13:27.902204 IP GRAF2.1380 > gucio.eaie.agh.edu.pl.80: . ack 15515 win 61312
10:13:27.902226 IP gucio.eaie.agh.edu.pl.80 > GRAF2.1380: P 15515:16735(1220) ack 385 win 6432
10:13:27.903369 IP GRAF2.1380 > gucio.eaie.agh.edu.pl.80: . ack 16735 win 65155
10:13:27.921424 IP gucio.eaie.agh.edu.pl.80 > GRAF2.1380: . 16735:18195(1460) ack 385 win 6432
10:13:27.921718 IP gucio.eaie.agh.edu.pl.80 > GRAF2.1380: . 18195:19655(1460) ack 385 win 6432
10:13:27.921921 IP GRAF2.1380 > gucio.eaie.agh.edu.pl.80: . ack 19655 win 65535
10:13:27.921944 IP gucio.eaie.agh.edu.pl.80 > GRAF2.1380: P 19655:21017(1362) ack 385 win 6432
10:13:27.922172 IP GRAF2.1380 > gucio.eaie.agh.edu.pl.80: . ack 21017 win 64173
10:13:27.937580 IP gucio.eaie.agh.edu.pl.80 > GRAF2.1380: . 21017:22477(1460) ack 385 win 6432
10:13:27.937904 IP gucio.eaie.agh.edu.pl.80 > GRAF2.1380: . 22477:23937(1460) ack 385 win 6432
10:13:27.938111 IP GRAF2.1380 > gucio.eaie.agh.edu.pl.80: . ack 23937 win 61253
10:13:27.938135 IP gucio.eaie.agh.edu.pl.80 > GRAF2.1380: P 23937:24823(886) ack 385 win 6432
10:13:27.938252 IP gucio.eaie.agh.edu.pl.80 > GRAF2.1380: F 24823:24823(0) ack 385 win 6432
10:13:27.938395 IP GRAF2.1380 > gucio.eaie.agh.edu.pl.80: . ack 24824 win 60367
10:13:27.941552 IP GRAF2.1377 > 216.239.59.104.80: P 847:1254(407) ack 349 win 65187
10:13:27.943718 IP GRAF2.1381 > gucio.eaie.agh.edu.pl.80: S 1338320293:1338320293(0) win 65535 <mss 1460,nop,nop,sackOK>
10:13:27.944443 IP gucio.eaie.agh.edu.pl.80 > GRAF2.1381: S 3972334095:3972334095(0) ack 1338320294 win 5840 <mss 1460,nop,nop,sackOK>
10:13:27.944764 IP GRAF2.1381 > gucio.eaie.agh.edu.pl.80: . ack 1 win 65535
10:13:27.945666 IP GRAF2.1381 > gucio.eaie.agh.edu.pl.80: P 1:275(274) ack 1 win 65535
10:13:27.946595 IP gucio.eaie.agh.edu.pl.80 > GRAF2.1381: . ack 275 win 6432
10:13:27.947664 IP GRAF2.1380 > gucio.eaie.agh.edu.pl.80: . ack 24824 win 65489
10:13:27.948430 IP GRAF2.1380 > gucio.eaie.agh.edu.pl.80: F 385:385(0) ack 24824 win 65489
10:13:27.948591 IP gucio.eaie.agh.edu.pl.80 > GRAF2.1381: . 1:1461(1460) ack 275 win 6432
10:13:27.948832 IP gucio.eaie.agh.edu.pl.80 > GRAF2.1381: . 1461:2921(1460) ack 275 win 6432
10:13:27.949030 IP GRAF2.1381 > gucio.eaie.agh.edu.pl.80: . ack 2921 win 65535
10:13:27.949067 IP gucio.eaie.agh.edu.pl.80 > GRAF2.1380: . ack 386 win 6432
10:13:27.950532 IP gucio.eaie.agh.edu.pl.80 > GRAF2.1381: . 2921:4381(1460) ack 275 win 6432
10:13:27.950901 IP GRAF2.1381 > gucio.eaie.agh.edu.pl.80: . ack 4381 win 65535
10:13:27.950948 IP gucio.eaie.agh.edu.pl.80 > GRAF2.1381: . 4381:5841(1460) ack 275 win 6432
10:13:27.951115 IP gucio.eaie.agh.edu.pl.80 > GRAF2.1381: . 5841:7301(1460) ack 275 win 6432
10:13:27.951297 IP GRAF2.1381 > gucio.eaie.agh.edu.pl.80: . ack 7301 win 65535
10:13:27.951314 IP gucio.eaie.agh.edu.pl.80 > GRAF2.1381: FP 7301:7580(279) ack 275 win 6432
10:13:27.951664 IP GRAF2.1381 > gucio.eaie.agh.edu.pl.80: . ack 7581 win 65256
10:13:27.962556 IP GRAF2.1381 > gucio.eaie.agh.edu.pl.80: F 275:275(0) ack 7581 win 65256
10:13:27.963175 IP gucio.eaie.agh.edu.pl.80 > GRAF2.1381: . ack 276 win 6432
10:13:27.998616 IP 216.239.59.104.80 > GRAF2.1377: . ack 1254 win 8576
10:13:28.038681 IP 216.239.59.104.80 > GRAF2.1377: P 349:523(174) ack 1254 win 8576
10:13:28.058097 IP GRAF2.1382 > gucio.eaie.agh.edu.pl.80: S 631571305:631571305(0) win 65535 <mss 1460,nop,nop,sackOK>
10:13:28.061216 IP gucio.eaie.agh.edu.pl.80 > GRAF2.1382: S 3965170145:3965170145(0) ack 631571306 win 5840 <mss 1460,nop,nop,sackOK>
10:13:28.061583 IP GRAF2.1382 > gucio.eaie.agh.edu.pl.80: . ack 1 win 65535
10:13:28.071345 IP GRAF2.1382 > gucio.eaie.agh.edu.pl.80: P 1:360(359) ack 1 win 65535
10:13:28.072199 IP gucio.eaie.agh.edu.pl.80 > GRAF2.1382: . ack 360 win 6432
10:13:28.073418 IP gucio.eaie.agh.edu.pl.80 > GRAF2.1382: P 1:169(168) ack 360 win 6432
10:13:28.073702 IP gucio.eaie.agh.edu.pl.80 > GRAF2.1382: F 169:169(0) ack 360 win 6432
10:13:28.074048 IP GRAF2.1382 > gucio.eaie.agh.edu.pl.80: . ack 170 win 65367
10:13:28.074599 IP GRAF2.1382 > gucio.eaie.agh.edu.pl.80: F 360:360(0) ack 170 win 65367
10:13:28.075113 IP gucio.eaie.agh.edu.pl.80 > GRAF2.1382: . ack 361 win 6432
10:13:28.170840 IP GRAF2.1383 > gucio.eaie.agh.edu.pl.80: S 3804887394:3804887394(0) win 65535 <mss 1460,nop,nop,sackOK>
10:13:28.171566 IP gucio.eaie.agh.edu.pl.80 > GRAF2.1383: S 3969922911:3969922911(0) ack 3804887395 win 5840 <mss 1460,nop,nop,sackOK>
10:13:28.171889 IP GRAF2.1383 > gucio.eaie.agh.edu.pl.80: . ack 1 win 65535
10:13:28.231024 IP GRAF2.1384 > gucio.eaie.agh.edu.pl.80: S 4145380098:4145380098(0) win 65535 <mss 1460,nop,nop,sackOK>
10:13:28.231738 IP gucio.eaie.agh.edu.pl.80 > GRAF2.1384: S 3969286557:3969286557(0) ack 4145380099 win 5840 <mss 1460,nop,nop,sackOK>
10:13:28.232062 IP GRAF2.1384 > gucio.eaie.agh.edu.pl.80: . ack 1 win 65535
10:13:28.242361 IP GRAF2.1377 > 216.239.59.104.80: . ack 523 win 65013
10:13:28.254249 IP agent2.icsr.agh.edu.pl.137 > 149.156.99.185.137: UDP, length: 50
10:13:28.286506 IP GRAF2.1383 > gucio.eaie.agh.edu.pl.80: P 1:270(269) ack 1 win 65535
10:13:28.287368 IP gucio.eaie.agh.edu.pl.80 > GRAF2.1383: . ack 270 win 6432
10:13:28.287866 IP GRAF2.1384 > gucio.eaie.agh.edu.pl.80: P 1:272(271) ack 1 win 65535
10:13:28.289425 IP gucio.eaie.agh.edu.pl.80 > GRAF2.1383: . 1:1461(1460) ack 270 win 6432
10:13:28.289729 IP gucio.eaie.agh.edu.pl.80 > GRAF2.1383: . 1461:2921(1460) ack 270 win 6432
10:13:28.289944 IP GRAF2.1383 > gucio.eaie.agh.edu.pl.80: . ack 2921 win 65535
10:13:28.289968 IP gucio.eaie.agh.edu.pl.80 > GRAF2.1384: . ack 272 win 6432
10:13:28.290723 IP gucio.eaie.agh.edu.pl.80 > GRAF2.1384: . 1:1461(1460) ack 272 win 6432
10:13:28.291016 IP gucio.eaie.agh.edu.pl.80 > GRAF2.1384: . 1461:2921(1460) ack 272 win 6432
10:13:28.291228 IP GRAF2.1384 > gucio.eaie.agh.edu.pl.80: . ack 2921 win 65535
10:13:28.291252 IP gucio.eaie.agh.edu.pl.80 > GRAF2.1384: FP 2921:4084(1163) ack 272 win 6432
10:13:28.291508 IP GRAF2.1384 > gucio.eaie.agh.edu.pl.80: . ack 4085 win 64372
10:13:28.291721 IP gucio.eaie.agh.edu.pl.80 > GRAF2.1383: . 2921:4381(1460) ack 270 win 6432
10:13:28.291975 IP GRAF2.1383 > gucio.eaie.agh.edu.pl.80: . ack 4381 win 65535
10:13:28.291997 IP gucio.eaie.agh.edu.pl.80 > GRAF2.1383: . 4381:5841(1460) ack 270 win 6432
10:13:28.292148 IP gucio.eaie.agh.edu.pl.80 > GRAF2.1383: FP 5841:6697(856) ack 270 win 6432
10:13:28.292510 IP GRAF2.1383 > gucio.eaie.agh.edu.pl.80: . ack 6698 win 65535
10:13:28.301058 IP GRAF2.1384 > gucio.eaie.agh.edu.pl.80: F 272:272(0) ack 4085 win 64372
10:13:28.301669 IP gucio.eaie.agh.edu.pl.80 > GRAF2.1384: . ack 273 win 6432
10:13:28.322062 IP GRAF2.1383 > gucio.eaie.agh.edu.pl.80: F 270:270(0) ack 6698 win 65535
10:13:28.322669 IP gucio.eaie.agh.edu.pl.80 > GRAF2.1383: . ack 271 win 6432
10:13:28.393047 IP GRAF2.1385 > gucio.eaie.agh.edu.pl.80: S 377992982:377992982(0) win 65535 <mss 1460,nop,nop,sackOK>
10:13:28.393820 IP gucio.eaie.agh.edu.pl.80 > GRAF2.1385: S 3980335958:3980335958(0) ack 377992983 win 5840 <mss 1460,nop,nop,sackOK>
10:13:28.394151 IP GRAF2.1385 > gucio.eaie.agh.edu.pl.80: . ack 1 win 65535
10:13:28.414939 IP GRAF2.1385 > gucio.eaie.agh.edu.pl.80: P 1:270(269) ack 1 win 65535
10:13:28.415673 IP gucio.eaie.agh.edu.pl.80 > GRAF2.1385: . ack 270 win 6432
10:13:28.417216 IP gucio.eaie.agh.edu.pl.80 > GRAF2.1385: P 1:575(574) ack 270 win 6432
10:13:28.417513 IP gucio.eaie.agh.edu.pl.80 > GRAF2.1385: F 575:575(0) ack 270 win 6432
10:13:28.417868 IP GRAF2.1385 > gucio.eaie.agh.edu.pl.80: . ack 576 win 64961
10:13:28.434456 IP GRAF2.1386 > gucio.eaie.agh.edu.pl.80: S 573354608:573354608(0) win 65535 <mss 1460,nop,nop,sackOK>
10:13:28.435188 IP gucio.eaie.agh.edu.pl.80 > GRAF2.1386: S 3968109376:3968109376(0) ack 573354609 win 5840 <mss 1460,nop,nop,sackOK>
10:13:28.435504 IP GRAF2.1386 > gucio.eaie.agh.edu.pl.80: . ack 1 win 65535
10:13:28.437805 IP GRAF2.1385 > gucio.eaie.agh.edu.pl.80: F 270:270(0) ack 576 win 64961
10:13:28.438432 IP gucio.eaie.agh.edu.pl.80 > GRAF2.1385: . ack 271 win 6432
10:13:28.451707 IP GRAF2.1386 > gucio.eaie.agh.edu.pl.80: P 1:270(269) ack 1 win 65535
10:13:28.452443 IP gucio.eaie.agh.edu.pl.80 > GRAF2.1386: . ack 270 win 6432
10:13:28.453994 IP gucio.eaie.agh.edu.pl.80 > GRAF2.1386: P 1:645(644) ack 270 win 6432
10:13:28.454280 IP gucio.eaie.agh.edu.pl.80 > GRAF2.1386: F 645:645(0) ack 270 win 6432
10:13:28.454621 IP GRAF2.1386 > gucio.eaie.agh.edu.pl.80: . ack 646 win 64891
10:13:28.473088 IP GRAF2.1386 > gucio.eaie.agh.edu.pl.80: F 270:270(0) ack 646 win 64891
10:13:28.473629 IP gucio.eaie.agh.edu.pl.80 > GRAF2.1386: . ack 271 win 6432
10:13:28.510012 IP GRAF2.1387 > gucio.eaie.agh.edu.pl.80: S 610795682:610795682(0) win 65535 <mss 1460,nop,nop,sackOK>
10:13:28.510741 IP gucio.eaie.agh.edu.pl.80 > GRAF2.1387: S 3966498156:3966498156(0) ack 610795683 win 5840 <mss 1460,nop,nop,sackOK>
10:13:28.511063 IP GRAF2.1387 > gucio.eaie.agh.edu.pl.80: . ack 1 win 65535
10:13:28.512281 IP GRAF2.1387 > gucio.eaie.agh.edu.pl.80: P 1:267(266) ack 1 win 65535
10:13:28.513078 IP gucio.eaie.agh.edu.pl.80 > GRAF2.1387: . ack 267 win 6432
10:13:28.514275 IP gucio.eaie.agh.edu.pl.80 > GRAF2.1387: P 1:314(313) ack 267 win 6432
10:13:28.514539 IP gucio.eaie.agh.edu.pl.80 > GRAF2.1387: F 314:314(0) ack 267 win 6432
10:13:28.514873 IP GRAF2.1387 > gucio.eaie.agh.edu.pl.80: . ack 315 win 65222
10:13:28.517486 IP GRAF2.1387 > gucio.eaie.agh.edu.pl.80: F 267:267(0) ack 315 win 65222
10:13:28.518017 IP gucio.eaie.agh.edu.pl.80 > GRAF2.1387: . ack 268 win 6432
10:13:28.588542 IP wind.icsr.agh.edu.pl.137 > 149.156.99.185.137: UDP, length: 50
10:13:28.619376 IP GRAF2.1388 > gucio.eaie.agh.edu.pl.80: S 547732712:547732712(0) win 65535 <mss 1460,nop,nop,sackOK>
10:13:28.620143 IP gucio.eaie.agh.edu.pl.80 > GRAF2.1388: S 3971684871:3971684871(0) ack 547732713 win 5840 <mss 1460,nop,nop,sackOK>
10:13:28.620486 IP GRAF2.1388 > gucio.eaie.agh.edu.pl.80: . ack 1 win 65535
10:13:28.624173 IP GRAF2.1389 > gucio.eaie.agh.edu.pl.80: S 195807403:195807403(0) win 65535 <mss 1460,nop,nop,sackOK>
10:13:28.624976 IP gucio.eaie.agh.edu.pl.80 > GRAF2.1389: S 3974380402:3974380402(0) ack 195807404 win 5840 <mss 1460,nop,nop,sackOK>
10:13:28.625306 IP GRAF2.1389 > gucio.eaie.agh.edu.pl.80: . ack 1 win 65535
10:13:28.625878 IP GRAF2.1388 > gucio.eaie.agh.edu.pl.80: P 1:271(270) ack 1 win 65535
10:13:28.626838 IP gucio.eaie.agh.edu.pl.80 > GRAF2.1388: . ack 271 win 6432
10:13:28.628664 IP gucio.eaie.agh.edu.pl.80 > GRAF2.1388: P 1:1268(1267) ack 271 win 6432
10:13:28.628960 IP gucio.eaie.agh.edu.pl.80 > GRAF2.1388: F 1268:1268(0) ack 271 win 6432
10:13:28.629295 IP GRAF2.1388 > gucio.eaie.agh.edu.pl.80: . ack 1269 win 64268
10:13:28.633130 IP GRAF2.1389 > gucio.eaie.agh.edu.pl.80: P 1:270(269) ack 1 win 65535
10:13:28.633849 IP gucio.eaie.agh.edu.pl.80 > GRAF2.1389: . ack 270 win 6432
10:13:28.635476 IP gucio.eaie.agh.edu.pl.80 > GRAF2.1389: P 1:786(785) ack 270 win 6432
10:13:28.635692 IP gucio.eaie.agh.edu.pl.80 > GRAF2.1389: F 786:786(0) ack 270 win 6432
10:13:28.636025 IP GRAF2.1389 > gucio.eaie.agh.edu.pl.80: . ack 787 win 64750
10:13:28.636327 IP GRAF2.1388 > gucio.eaie.agh.edu.pl.80: F 271:271(0) ack 1269 win 64268
10:13:28.636858 IP gucio.eaie.agh.edu.pl.80 > GRAF2.1388: . ack 272 win 6432
10:13:28.652996 IP GRAF2.1389 > gucio.eaie.agh.edu.pl.80: F 270:270(0) ack 787 win 64750
10:13:28.653612 IP gucio.eaie.agh.edu.pl.80 > GRAF2.1389: . ack 271 win 6432
10:13:28.723065 IP GRAF2.1390 > gucio.eaie.agh.edu.pl.80: S 1864420797:1864420797(0) win 65535 <mss 1460,nop,nop,sackOK>
10:13:28.723792 IP gucio.eaie.agh.edu.pl.80 > GRAF2.1390: S 3971965225:3971965225(0) ack 1864420798 win 5840 <mss 1460,nop,nop,sackOK>
10:13:28.724124 IP GRAF2.1390 > gucio.eaie.agh.edu.pl.80: . ack 1 win 65535
10:13:28.735778 IP GRAF2.1391 > gucio.eaie.agh.edu.pl.80: S 1178035474:1178035474(0) win 65535 <mss 1460,nop,nop,sackOK>
10:13:28.736577 IP gucio.eaie.agh.edu.pl.80 > GRAF2.1391: S 3977734245:3977734245(0) ack 1178035475 win 5840 <mss 1460,nop,nop,sackOK>
10:13:28.736908 IP GRAF2.1391 > gucio.eaie.agh.edu.pl.80: . ack 1 win 65535
10:13:28.737950 IP GRAF2.1390 > gucio.eaie.agh.edu.pl.80: P 1:270(269) ack 1 win 65535
10:13:28.738796 IP gucio.eaie.agh.edu.pl.80 > GRAF2.1390: . ack 270 win 6432
10:13:28.739420 IP GRAF2.1391 > gucio.eaie.agh.edu.pl.80: P 1:270(269) ack 1 win 65535
10:13:28.740627 IP gucio.eaie.agh.edu.pl.80 > GRAF2.1390: P 1:1057(1056) ack 270 win 6432
10:13:28.740896 IP gucio.eaie.agh.edu.pl.80 > GRAF2.1390: F 1057:1057(0) ack 270 win 6432
10:13:28.741231 IP GRAF2.1390 > gucio.eaie.agh.edu.pl.80: . ack 1058 win 64479
10:13:28.741272 IP gucio.eaie.agh.edu.pl.80 > GRAF2.1391: . ack 270 win 6432
10:13:28.741931 IP gucio.eaie.agh.edu.pl.80 > GRAF2.1391: P 1:1058(1057) ack 270 win 6432
10:13:28.742221 IP gucio.eaie.agh.edu.pl.80 > GRAF2.1391: F 1058:1058(0) ack 270 win 6432
10:13:28.742565 IP GRAF2.1391 > gucio.eaie.agh.edu.pl.80: . ack 1059 win 64478
10:13:28.744937 IP GRAF2.1390 > gucio.eaie.agh.edu.pl.80: F 270:270(0) ack 1058 win 64479
10:13:28.745458 IP gucio.eaie.agh.edu.pl.80 > GRAF2.1390: . ack 271 win 6432
10:13:28.762663 IP GRAF2.1391 > gucio.eaie.agh.edu.pl.80: F 270:270(0) ack 1059 win 64478
10:13:28.763247 IP gucio.eaie.agh.edu.pl.80 > GRAF2.1391: . ack 271 win 6432
10:13:28.804251 IP GRAF2.1043 > luke.icsr.agh.edu.pl.53:  26707+ PTR? 104.59.239.216.in-addr.arpa. (45)
10:13:28.823729 IP GRAF2.1392 > gucio.eaie.agh.edu.pl.80: S 666130071:666130071(0) win 65535 <mss 1460,nop,nop,sackOK>
10:13:28.824456 IP gucio.eaie.agh.edu.pl.80 > GRAF2.1392: S 3970589623:3970589623(0) ack 666130072 win 5840 <mss 1460,nop,nop,sackOK>
10:13:28.824771 IP GRAF2.1392 > gucio.eaie.agh.edu.pl.80: . ack 1 win 65535
10:13:28.845184 IP GRAF2.1393 > gucio.eaie.agh.edu.pl.80: S 1110656602:1110656602(0) win 65535 <mss 1460,nop,nop,sackOK>
10:13:28.845992 IP gucio.eaie.agh.edu.pl.80 > GRAF2.1393: S 3973642010:3973642010(0) ack 1110656603 win 5840 <mss 1460,nop,nop,sackOK>
10:13:28.846331 IP GRAF2.1393 > gucio.eaie.agh.edu.pl.80: . ack 1 win 65535
10:13:28.847050 IP GRAF2.1392 > gucio.eaie.agh.edu.pl.80: P 1:270(269) ack 1 win 65535
10:13:28.847904 IP gucio.eaie.agh.edu.pl.80 > GRAF2.1392: . ack 270 win 6432
10:13:28.848558 IP GRAF2.1393 > gucio.eaie.agh.edu.pl.80: P 1:270(269) ack 1 win 65535
10:13:28.849986 IP gucio.eaie.agh.edu.pl.80 > GRAF2.1392: . 1:1461(1460) ack 270 win 6432
10:13:28.850265 IP gucio.eaie.agh.edu.pl.80 > GRAF2.1392: P 1461:1765(304) ack 270 win 6432
10:13:28.850473 IP GRAF2.1392 > gucio.eaie.agh.edu.pl.80: . ack 1765 win 65535
10:13:28.850497 IP gucio.eaie.agh.edu.pl.80 > GRAF2.1392: F 1765:1765(0) ack 270 win 6432
10:13:28.850840 IP GRAF2.1392 > gucio.eaie.agh.edu.pl.80: . ack 1766 win 65535
10:13:28.850861 IP gucio.eaie.agh.edu.pl.80 > GRAF2.1393: . ack 270 win 6432
10:13:28.851004 IP gucio.eaie.agh.edu.pl.80 > GRAF2.1393: P 1:739(738) ack 270 win 6432
10:13:28.851163 IP gucio.eaie.agh.edu.pl.80 > GRAF2.1393: F 739:739(0) ack 270 win 6432
10:13:28.851471 IP GRAF2.1393 > gucio.eaie.agh.edu.pl.80: . ack 740 win 64797
10:13:28.855659 IP GRAF2.1392 > gucio.eaie.agh.edu.pl.80: F 270:270(0) ack 1766 win 65535
10:13:28.860566 IP gucio.eaie.agh.edu.pl.80 > GRAF2.1392: . ack 271 win 6432
10:13:28.871202 IP GRAF2.1393 > gucio.eaie.agh.edu.pl.80: F 270:270(0) ack 740 win 64797
10:13:28.871744 IP gucio.eaie.agh.edu.pl.80 > GRAF2.1393: . ack 271 win 6432
10:13:28.919153 IP GRAF2.1394 > gucio.eaie.agh.edu.pl.80: S 3319230364:3319230364(0) win 65535 <mss 1460,nop,nop,sackOK>
10:13:28.919988 IP gucio.eaie.agh.edu.pl.80 > GRAF2.1394: S 3979980993:3979980993(0) ack 3319230365 win 5840 <mss 1460,nop,nop,sackOK>
10:13:28.920330 IP GRAF2.1394 > gucio.eaie.agh.edu.pl.80: . ack 1 win 65535
10:13:28.921703 IP GRAF2.1394 > gucio.eaie.agh.edu.pl.80: P 1:270(269) ack 1 win 65535
10:13:28.922496 IP gucio.eaie.agh.edu.pl.80 > GRAF2.1394: . ack 270 win 6432
10:13:28.923955 IP gucio.eaie.agh.edu.pl.80 > GRAF2.1394: P 1:564(563) ack 270 win 6432
10:13:28.924240 IP gucio.eaie.agh.edu.pl.80 > GRAF2.1394: F 564:564(0) ack 270 win 6432
10:13:28.924583 IP GRAF2.1394 > gucio.eaie.agh.edu.pl.80: . ack 565 win 64972
10:13:28.939595 IP luke.icsr.agh.edu.pl.53 > GRAF2.1043:  26707 NXDomain* 0/1/0 (105)
10:13:28.942286 IP GRAF2.1394 > gucio.eaie.agh.edu.pl.80: F 270:270(0) ack 565 win 64972
10:13:28.942815 IP gucio.eaie.agh.edu.pl.80 > GRAF2.1394: . ack 271 win 6432
10:13:28.946934 IP GRAF2.137 > 216.239.59.104.137: UDP, length: 50
10:13:28.974126 IP GRAF2.1395 > gucio.eaie.agh.edu.pl.80: S 3983714274:3983714274(0) win 65535 <mss 1460,nop,nop,sackOK>
10:13:28.974937 IP gucio.eaie.agh.edu.pl.80 > GRAF2.1395: S 3977758034:3977758034(0) ack 3983714275 win 5840 <mss 1460,nop,nop,sackOK>
10:13:28.975276 IP GRAF2.1395 > gucio.eaie.agh.edu.pl.80: . ack 1 win 65535
10:13:29.002678 IP agent2.icsr.agh.edu.pl.137 > 149.156.99.185.137: UDP, length: 50
10:13:29.010753 IP GRAF2.1396 > gucio.eaie.agh.edu.pl.80: S 1459202177:1459202177(0) win 65535 <mss 1460,nop,nop,sackOK>
10:13:29.011555 IP gucio.eaie.agh.edu.pl.80 > GRAF2.1396: S 3975056866:3975056866(0) ack 1459202178 win 5840 <mss 1460,nop,nop,sackOK>
10:13:29.011897 IP GRAF2.1396 > gucio.eaie.agh.edu.pl.80: . ack 1 win 65535
10:13:29.012611 IP GRAF2.1395 > gucio.eaie.agh.edu.pl.80: P 1:270(269) ack 1 win 65535
10:13:29.013467 IP gucio.eaie.agh.edu.pl.80 > GRAF2.1395: . ack 270 win 6432
10:13:29.013962 IP GRAF2.1396 > gucio.eaie.agh.edu.pl.80: P 1:270(269) ack 1 win 65535
10:13:29.014929 IP gucio.eaie.agh.edu.pl.80 > GRAF2.1395: P 1:554(553) ack 270 win 6432
10:13:29.015187 IP gucio.eaie.agh.edu.pl.80 > GRAF2.1395: F 554:554(0) ack 270 win 6432
10:13:29.015525 IP GRAF2.1395 > gucio.eaie.agh.edu.pl.80: . ack 555 win 64982
10:13:29.015552 IP gucio.eaie.agh.edu.pl.80 > GRAF2.1396: . ack 270 win 6432
10:13:29.016682 IP gucio.eaie.agh.edu.pl.80 > GRAF2.1396: . 1:1461(1460) ack 270 win 6432
10:13:29.016974 IP gucio.eaie.agh.edu.pl.80 > GRAF2.1396: . 1461:2921(1460) ack 270 win 6432
10:13:29.017175 IP GRAF2.1396 > gucio.eaie.agh.edu.pl.80: . ack 2921 win 65535
10:13:29.018507 IP GRAF2.1395 > gucio.eaie.agh.edu.pl.80: F 270:270(0) ack 555 win 64982
10:13:29.018668 IP gucio.eaie.agh.edu.pl.80 > GRAF2.1396: . 2921:4381(1460) ack 270 win 6432
10:13:29.018987 IP GRAF2.1396 > gucio.eaie.agh.edu.pl.80: . ack 4381 win 65535
10:13:29.019024 IP gucio.eaie.agh.edu.pl.80 > GRAF2.1396: . 4381:5841(1460) ack 270 win 6432
10:13:29.019188 IP gucio.eaie.agh.edu.pl.80 > GRAF2.1396: FP 5841:6840(999) ack 270 win 6432
10:13:29.019547 IP GRAF2.1396 > gucio.eaie.agh.edu.pl.80: . ack 6841 win 65535
10:13:29.019569 IP gucio.eaie.agh.edu.pl.80 > GRAF2.1395: . ack 271 win 6432
10:13:29.031837 IP GRAF2.1396 > gucio.eaie.agh.edu.pl.80: F 270:270(0) ack 6841 win 65535
10:13:29.032360 IP gucio.eaie.agh.edu.pl.80 > GRAF2.1396: . ack 271 win 6432
10:13:29.082400 IP GRAF2.1397 > gucio.eaie.agh.edu.pl.80: S 2336324600:2336324600(0) win 65535 <mss 1460,nop,nop,sackOK>
10:13:29.083197 IP gucio.eaie.agh.edu.pl.80 > GRAF2.1397: S 3972087111:3972087111(0) ack 2336324601 win 5840 <mss 1460,nop,nop,sackOK>
10:13:29.083532 IP GRAF2.1397 > gucio.eaie.agh.edu.pl.80: . ack 1 win 65535
10:13:29.085137 IP GRAF2.1397 > gucio.eaie.agh.edu.pl.80: P 1:270(269) ack 1 win 65535
10:13:29.085974 IP gucio.eaie.agh.edu.pl.80 > GRAF2.1397: . ack 270 win 6432
10:13:29.088086 IP gucio.eaie.agh.edu.pl.80 > GRAF2.1397: . 1:1461(1460) ack 270 win 6432
10:13:29.088409 IP gucio.eaie.agh.edu.pl.80 > GRAF2.1397: P 1461:2045(584) ack 270 win 6432
10:13:29.088625 IP GRAF2.1397 > gucio.eaie.agh.edu.pl.80: . ack 2045 win 65535
10:13:29.088650 IP gucio.eaie.agh.edu.pl.80 > GRAF2.1397: F 2045:2045(0) ack 270 win 6432
10:13:29.088983 IP GRAF2.1397 > gucio.eaie.agh.edu.pl.80: . ack 2046 win 65535
10:13:29.119518 IP GRAF2.1397 > gucio.eaie.agh.edu.pl.80: F 270:270(0) ack 2046 win 65535
10:13:29.120054 IP gucio.eaie.agh.edu.pl.80 > GRAF2.1397: . ack 271 win 6432
10:13:29.135408 IP GRAF2.1398 > gucio.eaie.agh.edu.pl.80: S 3733594810:3733594810(0) win 65535 <mss 1460,nop,nop,sackOK>
10:13:29.136130 IP gucio.eaie.agh.edu.pl.80 > GRAF2.1398: S 3976267755:3976267755(0) ack 3733594811 win 5840 <mss 1460,nop,nop,sackOK>
10:13:29.136447 IP GRAF2.1398 > gucio.eaie.agh.edu.pl.80: . ack 1 win 65535
10:13:29.137766 IP GRAF2.1398 > gucio.eaie.agh.edu.pl.80: P 1:270(269) ack 1 win 65535
10:13:29.138555 IP gucio.eaie.agh.edu.pl.80 > GRAF2.1398: . ack 270 win 6432
10:13:29.140608 IP gucio.eaie.agh.edu.pl.80 > GRAF2.1398: . 1:1461(1460) ack 270 win 6432
10:13:29.140910 IP gucio.eaie.agh.edu.pl.80 > GRAF2.1398: P 1461:1980(519) ack 270 win 6432
10:13:29.141129 IP GRAF2.1398 > gucio.eaie.agh.edu.pl.80: . ack 1980 win 65535
10:13:29.141155 IP gucio.eaie.agh.edu.pl.80 > GRAF2.1398: F 1980:1980(0) ack 270 win 6432
10:13:29.141493 IP GRAF2.1398 > gucio.eaie.agh.edu.pl.80: . ack 1981 win 65535
10:13:29.155193 IP GRAF2.1398 > gucio.eaie.agh.edu.pl.80: F 270:270(0) ack 1981 win 65535
10:13:29.160379 IP gucio.eaie.agh.edu.pl.80 > GRAF2.1398: . ack 271 win 6432
10:13:29.189252 IP GRAF2.1399 > gucio.eaie.agh.edu.pl.80: S 257554947:257554947(0) win 65535 <mss 1460,nop,nop,sackOK>
10:13:29.189970 IP gucio.eaie.agh.edu.pl.80 > GRAF2.1399: S 3971536642:3971536642(0) ack 257554948 win 5840 <mss 1460,nop,nop,sackOK>
10:13:29.190288 IP GRAF2.1399 > gucio.eaie.agh.edu.pl.80: . ack 1 win 65535
10:13:29.191335 IP GRAF2.1399 > gucio.eaie.agh.edu.pl.80: P 1:274(273) ack 1 win 65535
10:13:29.192128 IP gucio.eaie.agh.edu.pl.80 > GRAF2.1399: . ack 274 win 6432
10:13:29.193624 IP gucio.eaie.agh.edu.pl.80 > GRAF2.1399: P 1:616(615) ack 274 win 6432
10:13:29.193861 IP gucio.eaie.agh.edu.pl.80 > GRAF2.1399: F 616:616(0) ack 274 win 6432
10:13:29.194204 IP GRAF2.1399 > gucio.eaie.agh.edu.pl.80: . ack 617 win 64920
10:13:29.212607 IP GRAF2.1399 > gucio.eaie.agh.edu.pl.80: F 274:274(0) ack 617 win 64920
10:13:29.213137 IP gucio.eaie.agh.edu.pl.80 > GRAF2.1399: . ack 275 win 6432
10:13:29.338524 IP wind.icsr.agh.edu.pl.137 > 149.156.99.185.137: UDP, length: 50
10:13:29.415856 IP GRAF2.1400 > gucio.eaie.agh.edu.pl.80: S 1879354154:1879354154(0) win 65535 <mss 1460,nop,nop,sackOK>
10:13:29.416674 IP gucio.eaie.agh.edu.pl.80 > GRAF2.1400: S 3980402179:3980402179(0) ack 1879354155 win 5840 <mss 1460,nop,nop,sackOK>
10:13:29.417022 IP GRAF2.1400 > gucio.eaie.agh.edu.pl.80: . ack 1 win 65535
10:13:29.433288 IP GRAF2.1401 > gucio.eaie.agh.edu.pl.80: S 2365454939:2365454939(0) win 65535 <mss 1460,nop,nop,sackOK>
10:13:29.433999 IP gucio.eaie.agh.edu.pl.80 > GRAF2.1401: S 3966421478:3966421478(0) ack 2365454940 win 5840 <mss 1460,nop,nop,sackOK>
10:13:29.434316 IP GRAF2.1401 > gucio.eaie.agh.edu.pl.80: . ack 1 win 65535
10:13:29.435322 IP GRAF2.1400 > gucio.eaie.agh.edu.pl.80: P 1:270(269) ack 1 win 65535
10:13:29.436166 IP gucio.eaie.agh.edu.pl.80 > GRAF2.1400: . ack 270 win 6432
10:13:29.436663 IP GRAF2.1401 > gucio.eaie.agh.edu.pl.80: P 1:270(269) ack 1 win 65535
10:13:29.437779 IP gucio.eaie.agh.edu.pl.80 > GRAF2.1400: P 1:799(798) ack 270 win 6432
10:13:29.438050 IP gucio.eaie.agh.edu.pl.80 > GRAF2.1400: F 799:799(0) ack 270 win 6432
10:13:29.438387 IP GRAF2.1400 > gucio.eaie.agh.edu.pl.80: . ack 800 win 64737
10:13:29.438429 IP gucio.eaie.agh.edu.pl.80 > GRAF2.1401: . ack 270 win 6432
10:13:29.438914 IP gucio.eaie.agh.edu.pl.80 > GRAF2.1401: P 1:732(731) ack 270 win 6432
10:13:29.439197 IP gucio.eaie.agh.edu.pl.80 > GRAF2.1401: F 732:732(0) ack 270 win 6432
10:13:29.439538 IP GRAF2.1401 > gucio.eaie.agh.edu.pl.80: . ack 733 win 64804
